{
  "$type": "acquisition_receipt",
  "schema_version": "1.0.0",
  "acquisition_id": "acq_binance_spot_1d_20240101_btc",
  "snapshot_id": "ds-snap_binance_spot_1d_v1",
  "provider_archive_uri": "https://data.binance.vision/data/spot/daily/klines/BTCUSDT/1d/BTCUSDT-1d-2024-01-01.zip",
  "provider_archive_filename": "BTCUSDT-1d-2024-01-01.zip",
  "publisher_checksum_uri": "https://data.binance.vision/data/spot/daily/klines/BTCUSDT/1d/BTCUSDT-1d-2024-01-01.zip.CHECKSUM",
  "retrieval_time": "2026-08-28T00:00:00Z",
  "publisher_sha256": "sha256:22e6654e4eedb6e42b01cc501eb20198229a64051409fe239326ae62617764ca",
  "raw_artifact_sha256": "sha256:22e6654e4eedb6e42b01cc501eb20198229a64051409fe239326ae62617764ca",
  "raw_byte_size": 23,
  "normalizer_id": "binance_kline_spot_1d",
  "normalizer_version": "1.0.0",
  "normalized_snapshot_sha256": "sha256:0000000000000000000000000000000000000000000000000000000000000000",
  "manifest_sha256": "sha256:ebf82456b5eb1a2066c0c09e52b3c963acd20a32ad2f7d61ca160fff1fd0bce2",
  "verification_outcome": "ACCEPTED",
  "failure_reasons": [],
  "license": "Upstream repository labelled MIT; raw archive redistribution not asserted"
}
